{
  "schema": 2,
  "release": {
    "id": "omarchy-ps4-4.0.0-baikal-b1-partitioned-dev1",
    "version": "4.0.0-partitioned-dev1",
    "channel": "edge",
    "sequence": 3,
    "published_at": "2026-10-16T00:00:00Z"
  },
  "target": {
    "architecture": "x86_64",
    "models": [
      "ps4-slim"
    ],
    "southbridges": [
      "baikal-b1"
    ],
    "root_transport": "usb",
    "root_layout": "partitioned-usb",
    "root_filesystem": "ext4",
    "root_label": "OMARCHY-PS4"
  },
  "first_boot": {
    "mode": "deferred-owner",
    "pending_marker": "/var/lib/omarchy-ps4/provisioning/pending",
    "service": "omarchy-ps4-provision-owner.service",
    "default_password": false
  },
  "loader": {
    "delivery": "embedded",
    "app_path": "/app0/assets/misc/ps4-linux-loader.elf",
    "source_url": "https://github.com/ps4-linux/ps4-linux-loader",
    "source_commit": "9acef9fbf79097a2bb39d6c9c17228198bc445cc",
    "version": "v25",
    "sha256": "c813d169ef37e4bee574a5058bc6c0b92564e74ab445ef0846d67fa9d1e5ce65",
    "license": "NOASSERTION"
  },
  "boot_set": {
    "storage": "orbis-internal",
    "active_path": "/data/linux/boot",
    "previous_suffix": ".omarchy-prev",
    "transaction_marker": "/data/linux/.omarchy-ps4-staging",
    "vram_mb": 1024,
    "artifacts": [
      {
        "name": "bzImage",
        "role": "kernel",
        "app_path": "/app0/assets/misc/bzImage",
        "active_name": "bzImage",
        "size": 11060224,
        "sha256": "b7c8b9d67c600ee08b2321f7f4fac08c506791b0ab9c3f3d01598a90471a9de5"
      },
      {
        "name": "initramfs.cpio.gz",
        "role": "initramfs",
        "app_path": "/app0/assets/misc/initramfs.cpio.gz",
        "active_name": "initramfs.cpio.gz",
        "size": 1686082,
        "sha256": "31e793671aca8b595e130fa9d1ba5a93f0d777ee45843eb1aa3925294b0dc353"
      },
      {
        "name": "bootargs.txt",
        "role": "bootargs",
        "app_path": "/app0/assets/misc/bootargs.txt",
        "active_name": "bootargs.txt",
        "size": 494,
        "sha256": "dabd2779ac7f172ac3f534a93883694155d8b0c51d6fe2247597cc7fb111bb84"
      },
      {
        "name": "vram.txt",
        "role": "vram",
        "app_path": "/app0/assets/misc/vram.txt",
        "active_name": "vram.txt",
        "size": 5,
        "sha256": "4f71bb761ace37c88826cd8cc1c948e1cf5b5d0cd153dc651a6efdb3dfb9f2b1"
      }
    ]
  },
  "usb_image": {
    "name": "omarchy-ps4-usb-4.0.0-partitioned-dev1.img.xz",
    "url": "https://downloads.example.invalid/omarchy-ps4/private/omarchy-ps4-usb-4.0.0-partitioned-dev1.img.xz",
    "compression": "xz",
    "compressed_size": 1,
    "sha256": "0000000000000000000000000000000000000000000000000000000000000000",
    "uncompressed_size": 1,
    "uncompressed_sha256": "0000000000000000000000000000000000000000000000000000000000000000",
    "layout": "partitioned-usb",
    "filesystem": "ext4",
    "label": "OMARCHY-PS4",
    "minimum_device_bytes": 32000000000,
    "auto_grow": false,
    "contains_boot_files": true,
    "partition_table": "dos",
    "logical_sector_bytes": 512,
    "partitions": [
      {
        "number": 1,
        "role": "boot",
        "filesystem": "fat32",
        "label": "PS4BOOT",
        "start_sector": 2048,
        "size_sectors": 8388608,
        "partition_type": "0c",
        "bootable": true
      },
      {
        "number": 2,
        "role": "system",
        "filesystem": "ext4",
        "label": "OMARCHY-PS4",
        "start_sector": 8390656,
        "size": "remaining",
        "partition_type": "83",
        "bootable": false
      }
    ]
  },
  "private_profile": {
    "name": "private-kernel-manager-partitioned",
    "app_version": "0.32",
    "release_eligible": false
  }
}
